number,forum,title,abstract,authors,decision
1,https://openreview.net/forum?id=uEuoKy2hUkm,Echocardiographic Phase Detection Using Neural Networks,"Accurate identification of end-diastolic and end-systolic frames in echocardiographic cine loops is essential when measuring cardiac function. Manual selection by human experts is challenging and error prone. This paper presents a deep neural network trained and tested on multi-centre patient data for accurate phase detection in apical four-chamber videos of arbitrary length, spanning several heartbeats, with performance indistinguishable from that of human experts.",Elisabeth Sarah Lane|Neda Azarmehr|Jevgeni Jevsikov|James P Howard|Matthew Shun-shin|Darrel P Francis|Massoud Zolgharni,Accept (Poster)
4,https://openreview.net/forum?id=h3HC1EU7AEz,ViT-V-Net: Vision Transformer for Unsupervised Volumetric Medical Image Registration,"In the last decade, convolutional neural networks (ConvNets) have dominated and achieved state-of-the-art performances in a variety of medical imaging applications. However, the performances of ConvNets are still limited by lacking the understanding of long-range spatial relations in an image. The recently proposed Vision Transformer (ViT) for image classification uses a purely self-attention-based model that learns long-range spatial relations to focus on the relevant parts of an image. Nevertheless, ViT emphasizes the low-resolution features because of the consecutive downsamplings, result in a lack of detailed localization information, making it unsuitable for image registration. Recently, several ViT-based image segmentation methods have been combined with ConvNets to improve the recovery of detailed localization information. Inspired by them, we present ViT-V-Net, which bridges ViT and ConvNet to provide volumetric medical image registration. The experimental results presented here demonstrate that the proposed architecture achieves superior performance to several top-performing registration methods.",Junyu Chen|Yufan He|Eric Frey|Ye Li|Yong Du,Accept (Poster)
5,https://openreview.net/forum?id=pOFGaVQeXAk,Deep Clustering Activation Maps for Emphysema Subtyping,"We propose a deep learning clustering method that exploits dense features from a segmentation network for emphysema subtyping from computed tomography (CT) scans. Using dense features enables high-resolution visualization of image regions corresponding to the cluster assignment via dense clustering activation maps (dCAMs). This approach provides model interpretability. We evaluated clustering results on 500 subjects from the COPDGene study, where radiologists manually annotated emphysema sub-types according to their visual CT assessment. We achieved a 43% unsupervised clustering accuracy, outperforming our baseline at 41% and yielding results comparable to supervised classification at 45%. The proposed method also offers a better cluster formation than the baseline, achieving 0.54 in silhouette coefficient and 0.55 in David-Bouldin scores.",Weiyi Xie|Colin Jacobs|Bram van Ginneken,Accept (Poster)
6,https://openreview.net/forum?id=9CSM4yQmZiN,Learning to predict cutting angles from histological human brain sections,"Studying brain architecture at the cellular level requires histological image analysis of sectioned postmortem samples. We trained a deep neural network to estimate relative angles between the cutting plane and the local 3D brain surface from 2D cortical image patches sampled from microscopic scans of human brain tissue sections. The model allows to automatically identify obliquely cut tissue parts, which often confuse downstream texture classification tasks and typically require specific treatment in image analysis workflows. It has immediate applications for the automated analysis of brain structures, like cytoarchitectonic mapping of the highly convoluted human brain.
",Christian Schiffer|Luisa Schuhmacher|Katrin Amunts|Timo Dickscheid,Accept (Poster)
8,https://openreview.net/forum?id=fnb58KJtYv,50 shades of overfitting:  towards MRI-based neurologicalmodels interpretation,"MRI-based prediction models are one of the most exploited AI solutions in neurology. Numerous computer-vision models showed their predictive ability for diverse psychoneurological conditions. Although most of these models are based on weak or no annotation, only a few reported studies interpret the predictions and perform the model saliency regions' analysis.

We utilize 3DCNN interpretation with GradCAM to explore learned patterns for basic demographic characteristics prediction on the healthy cohort. We compare the saliency maps of the gender prediction models with the different types of MRI data preprocessing and augmentation. We assess the quality of learned patterns and examine the ways of models overfitting. We propose a data augmentation strategy based on optimal transport to avoid model overfitting on the brain volumes.",Polina Druzhinina|Ekaterina Kondrateva|Evgeny Burnaev,Accept (Poster)
13,https://openreview.net/forum?id=OcATYbGIxv4,Quantifying the Scanner-Induced Domain Gap in Mitosis Detection,"Automated detection of mitotic figures in histopathology images has seen vast improvements, thanks to modern deep learning-based pipelines. Application of these methods, however, is in practice limited by strong variability of images between labs. This results in a domain shift of the images, which causes a performance drop of the models. Hypothesizing that the scanner device plays a decisive role in this effect, we evaluated the susceptibility of a standard mitosis detection approach to the domain shift introduced by using a different whole slide scanner. Our work is based on the MICCAI-MIDOG challenge 2021 data set, which includes 200 tumor cases of human breast cancer and four scanners.  

Our work indicates that the domain shift induced not by biochemical variability but purely by the choice of acquisition device is underestimated so far. Models trained on images of the same scanner yielded an average F1 score of 0.683, while models trained on a single other scanner only yielded an average F1 score of 0.325. Training on another multi-domain mitosis dataset led to mean F1 scores of 0.52. We found this not to be reflected by domain-shifts measured as proxy A distance-derived metric.",Marc Aubreville,Accept (Poster)
15,https://openreview.net/forum?id=1TPRpNyyj2L,Carbon footprint driven deep learning model selection for medical imaging,"Selecting task appropriate deep learning models is a resource intensive process; more so when working with large quantities of high dimensional data that are encountered in medical imaging. Model selection procedures that are primarily aimed at improving performance measures such as accuracy could become biased towards resource intensive models. In this work, we propose to inform and drive the model selection procedure using the carbon footprint of training deep learning models as a complementary measure along with other standard performance metrics. We experimentally demonstrate that increasing carbon footprint of large models might not necessarily translate into proportional performance gains, and suggest useful trade-offs to obtain resource efficient models.",Raghavendra Selvan,Accept (Poster)
19,https://openreview.net/forum?id=RFwhfWEMyzm,Exploiting Adam-like Optimization Algorithms to Improve the Performance of Convolutional Neural Networks,"Stochastic gradient descent (SGD) is the main approach for training deep networks: it moves towards the optimum of the cost function by  iteratively updating the parameters of a model in the direction of the gradient of the loss evaluated on a minibatch. Several variants of SGD have been proposed to make adaptive step sizes for each parameter (adaptive gradient) and take into account the previous updates (momentum). Among several alternative of SGD the most popular are AdaGrad, AdaDelta, RMSProp and Adam which scale coordinates of the gradient by square roots of some form of averaging of the squared coordinates in the past gradients and automatically adjust the learning rate on a parameter basis. In this work, we compare Adam based variants based on the difference between the present and the past gradients, the step size is adjusted for each parameter. We run several tests benchmarking proposed methods using medical image data. The experiments are performed using ResNet50 architecture neural network. Moreover, we have tested ensemble of networks and the fusion with ResNet50 trained with stochastic gradient descent. To combine the set of ResNet50 the simple sum rule has been applied. Proposed ensemble obtains very high performance, it obtains accuracy comparable or better than actual state of the art. To improve reproducibility and research efficiency the MATLAB source code used for this research is available at GitHub: https://github.com/LorisNanni.",Loris Nanni|Gianluca Maguolo|Alessandra Lumini,Accept (Poster)
20,https://openreview.net/forum?id=164F3ixC9Jc,ICAM-reg: Interpretable Classification and Regression with Feature Attribution for Mapping Neurological Phenotypes in Individual Scans,"Feature attribution (FA), or the assignment of class-relevance to different locations in an image, is important for many classification and regression problems but is particularly crucial within the neuroscience domain, where accurate mechanistic models of behaviours, or disease, require knowledge of all features discriminative of a trait. At the same time, predicting class relevance from brain images is challenging as phenotypes are typically heterogeneous, and changes occur against a background of significant natural variation.  Here, we present an extension of the ICAM framework for creating prediction specific FA maps through image-to-image translation.",Cher Bass|Mariana da Silva|Carole H. Sudre|Logan Zane John Williams|Petru-Daniel Tudosiu|Fidel Alfaro-Almagro|Sean P. Fitzgibbon|Matthew Glasser|Stephen M. Smith|Emma Claire Robinson,Accept (Poster)
21,https://openreview.net/forum?id=76X9Mthzv4X,Common limitations of performance metrics in biomedical image analysis,"While the importance of automatic biomedical image analysis is increasing at an enormous pace, recent meta-research revealed major flaws with respect to algorithm validation. Performance metrics are key for objective, transparent and comparative performance assessment, but little attention has been given to their pitfalls. Under the umbrella of the Helmholtz Imaging Platform (HIP), three international initiatives - the MICCAI Society's challenge working group, the Biomedical Image Analysis Challenges (BIAS) initiative, as well as the benchmarking working group of the MONAI framework - have now joined forces with the mission to generate best practice recommendations with respect to metrics in medical image analysis. Consensus building is achieved via a Delphi process, a popular tool for integrating opinions in large international consortia. The current document serves as a teaser for the results presentation and focuses on the pitfalls of the most commonly used metric in biomedical image analysis, the Dice Similarity Coefficient (DSC), in the categories of (1) mathematical properties/edge cases, (2) task/metric fit and (3) metric aggregation. Being compiled by a large group of experts from more than 30 institutes worldwide, we believe that our framework could be of general interest to the MIDL community and will improve the quality of biomedical image analysis algorithm validation. ",Annika Reinke|Matthias Eisenmann|Minu Dietlinde Tizabi|Carole H. Sudre|Tim Rädsch|Michela Antonelli|Tal Arbel|Spyridon Bakas|M. Jorge Cardoso|Veronika Cheplygina|Keyvan Farahani|Ben Glocker|Doreen Heckmann-Nötzel|Fabian Isensee|Pierre Jannin|Charles Kahn|Jens Kleesiek|Tahsin Kurc|Michal Kozubek|Bennett A. Landman|Geert Litjens|Klaus Maier-Hein|Anne Lousise Martel|bjoern menze|Henning Müller|Jens Petersen|Mauricio Reyes|Nicola Rieke|Bram Stieltjes|Ronald M. Summers|Sotirios A. Tsaftaris|Bram van Ginneken|Annette Kopp-Schneider|Paul Jäger|Lena Maier-Hein,Accept (Poster)
24,https://openreview.net/forum?id=NJcszyl19PN,Deep ensembles based on Stochastic Activation Selection for Polyp Segmentation,"Semantic segmentation has a wide array of applications ranging from medical-image analysis, scene understanding, autonomous driving and robotic navigation. This work deals with medical image segmentation and in particular with accurate polyp detection and segmentation during colonoscopy examinations. Several convolutional neural network architectures have been proposed to effectively deal with this task and with the problem of segmenting objects at different scale input. The basic architecture in image segmentation consists of an encoder and a decoder: the first uses convolutional filters to extract features from the image, the second is responsible for generating the final output. In this work, we compare some variant of the DeepLab architecture obtained by varying the decoder backbone. We compare several decoder architectures, including ResNet, Xception, EfficentNet, MobileNet and we perturb their layers by substituting ReLU activation layers with other functions. The resulting methods are used to create deep ensembles which are shown to be very effective. Our experimental evaluations show that our best ensemble produces good segmentation results by achieving high evaluation scores with a dice coefficient of  0.884, and a mean Intersection over Union (mIoU) of 0.818 for the Kvasir-SEG dataset. To improve reproducibility and research efficiency the MATLAB source code used for this research is available at GitHub: https://github.com/LorisNanni.",Alessandra Lumini|Loris Nanni|Gianluca Maguolo,Accept (Poster)
25,https://openreview.net/forum?id=XCRthDLsCXn,Partial Convolution Network for Metal Artifact Reduction in CT Preprocessing: Preliminary Results,"Metal artifacts impair the diagnostic value of medical CT images. These artifacts occur from the projection values associated with the metal objects inside the scanned anatomy. In this work, we replace the corrupted projection values by using a deep convolutional neural network consisting of so-called partial convolution layers. 
We show that the network trained on simulated data enhances newly presented projection data and therefore the corresponding reconstructed image. ",Laura Hellwege|Nele Blum|Thorsten Buzug|Maik Stille,Accept (Poster)
28,https://openreview.net/forum?id=84NU3uAj1HW,Projection Domain Metal Artifact Reduction in Computed Tomography using Conditional Generative Adversarial Networks,"High-density objects in the field of view, still remain one of the major challenges in CT
image reconstruction. They cause artifacts in the image, which degrade the quality and
the diagnostic value of the image. Standard approaches for metal artifact reduction are
often unable to correct these artifacts sufficiently or introduce new artifacts. In this work,
a new deep learning approach for the reduction of metal artifacts in CT images is proposed
using a Generative Adversarial Network. A generator network is applied directly to the
projection data corrupted by the metal objects to learn the corrected data. In addition, a
second network, the discriminator, is used to evaluate the quality of the learned data. The
results of the trained generator network show that most of the data could be reasonably
replaced by the network, reducing the artifacts in the reconstructed image.",Nele Blum|Thorsten Buzug|Maik Stille,Accept (Poster)
31,https://openreview.net/forum?id=eehADvdlUa3,Morphology-based losses for weakly supervised segmentation of mammograms,"Segmentation is one of the most common tasks in medical imaging, but it often requires expensive ground truth for training. Weakly supervised methods cope with the lack of annotations, however, they often fall short compared to fully supervised ones. In this work, we propose to constrain the segmentation output with morphological operations, leading to an increase in the overall performance. In particular, we use top-hat and closing operations. We evaluate the method on high-resolution images from INBreast dataset and achieve an increase in F$_1$ of $\approx 0.14$ and in recall of $\approx 0.22$ compared to the training without morphology loss.",Mickael Tardy|Diana Mateus,Accept (Poster)
33,https://openreview.net/forum?id=GHNGMR1EAtN,Predicting molecular subtypes of breast cancer using multimodal deep learning and incorporation of the attention mechanism,"Accurately determining the molecular subtype of breast cancer is an important factor for the prognosis of breast cancer patients, and can guide treatment selection. In this study, we report a multimodal deep learning with attention mechanism (MDLA) for predicting the molecular subtypes of breast cancer from mammography and ultrasound images. Incorporation of the attention mechanism improved diagnostic performance for predicting 4-class molecular subtypes with Matthews correlation coefficient (MCC) of 0.794. The MDLA can also discriminate between Luminal disease and non-luminal disease with areas under the receiver operating characteristic curve (AUC) of 0.855. This work thus provides a noninvasive imaging biomarker to predict the molecular subtypes of breast cancer.",Tianyu Zhang|Luyi Han|Yuan Gao|Xin Wang|Regina Beets-Tan|Ritse Mann,Accept (Poster)
34,https://openreview.net/forum?id=dVUHL5QhDhL,Efficient Video-Based Deep Learning for Ultrasound Guided Needle Insertion,"We investigate video-based deep learning approaches for detecting needle insertions in ultrasound videos. We introduce two efficient and conceptually simple extensions to convert standard 2D object detectors into video object detectors that make use of temporal information from a history of frames. We compare our approaches to a 2D baseline method that makes independent predictions per frame. Given the need to run in real-time on computationally restricted environments, emphasis is placed on low computational complexity.",Jonathan Rubin|Alvin Chen|Anumod Odungattu Thodiyil|Raghavendra Srinivasa Naidu|Ramon Erkamp|Jon Fincke|Balasundar Raju,Accept (Poster)
35,https://openreview.net/forum?id=rKiYUGvII6,mGEV: Extension of the GEV Activation to Multiclass Classification,"Unbalanced data poses a challenge when training machine learning algorithms; the algorithm often overfits on the dominant class and neglects the smaller classes. While methods such as oversampling aim to rebalance the data, this can lead to overfitting. When a certain class is underrepresented, either because it a rare disease or few images exist then methods are needed which can adequately account for this. The generalized extreme value (GEV) activation has recently been proposed as a solution to highly unbalanced data; however, the GEV activation is only available for binary classification. We extend this to the multiclass case with the multiclass GEV (mGEV) activation. We conduct experiments on X-ray images, with three classes, showing much-improved performance over the commonly used softmax activation. Code for the mGEV activation is available at [https://github.com/JTBridge/GEV].",Joshua Thomas Bridge|Yalin Zheng,Accept (Poster)
36,https://openreview.net/forum?id=oJi6xpSLdsj,VinDr-RibCXR: A Benchmark Dataset for Automatic Segmentation and Labeling of Individual Ribs on Chest X-rays,"Segmenting and labeling correctly the individual ribs from chest radiograph (CXR) are of significant clinical value for several diagnostic tasks. Developing automatic deep learning (DL) algorithms for this task requires annotated images of the ribs at pixel-level. However, to the best of our knowledge, there exists no such public datasets as well as benchmark protocols for performance evaluation. To solve this problem, we establish a new CXR dataset, namely VinDr-RibCXR, for automatically segmenting and labeling of individual ribs. The VinDr-RibCXR contains 245 posteroanterior CXRs with corresponding segmentation annotations for each rib provided by human experts. Furthermore, we train the state-of-the-art DL-based segmentation models on 196 images from the RibCXR and report performance of those models on an independent test set of 49 images. Our best performing DL model (i.e., Nested U-Net with EfficientNet-B0)  obtains  a  Dice  score  of  0.834 (95% CI, 0.810-0.853). The  sensitivity,  specificity  and  Hausdorff distance are 0.841 (95% CI, 0.812-0.858), 0.998 (95% CI, 0.997-0.998), and 15.453 (95% CI, 13.340-17.450), respectively. These results demonstrate a high-level of performance in labeling of the individual ribs from CXRs. Our study, therefore, serves as a proof of concept and baseline performance for future research. The dataset, codes, and trained DL models will be made publicly available to encourage new advances in this research direction.",Hoang Canh Nguyen|Tung Thanh Le|Hieu Pham|Ha Quy Nguyen,Accept (Poster)
37,https://openreview.net/forum?id=O9EWFKXcXTU,ProtoBrainMaps: Prototypical Brain Maps for Alzheimer's Disease Progression Modeling,"Discovering the brain progression over a lifetime is beneficial for identifying the subject affected by neurodegenerative disorders, such as Alzheimer's disease (AD) which require detection at the earliest possible time for the sake of delaying the progression by the virtue of particular treatments. As brain progressions in terms of both normal aging and AD-pathology tend to be entangled to each other, distinguishing the progression pathways of AD over the normal aging brains is quite an intricate task. To this end, we propose Prototypical Brain Maps (ProtoBrainMaps) for modeling the AD progressions through the established prototypes in the latent space via clinically-guided topological maps. Having devised as an interpretable network, it possesses the ability to establish and synthesize a set of well-interpolated prototypical brains, each corresponding to certain health conditions in terms of neurodegenerative diseases. ",Ahmad Wisnu Mulyadi|Heung-Il Suk,Accept (Poster)
46,https://openreview.net/forum?id=JG895xlWsfA,Multichannel input pixelwise regression 3D U-Nets for medical image estimation with 3 applications in brain MRI,"The U-Net is a robust general-purpose deep learning architecture designed for semantic segmentation of medical images, and has been extended to 3D for volumetric applications such as magnetic resonance imaging (MRI) of the human brain. An adaptation of the U-Net to output pixelwise regression values, instead of class labels, based on multichannel input data, has been developed in the remote sensing satellite imaging research domain. The pixelwise regression U-Net has only received limited consideration as a deep learning architecture in medical imaging for the image estimation/synthesis problem, and the limited work so far did not consider the application of 3D multichannel inputs. In this paper, we propose the use of the multichannel input pixelwise regression 3D U-Net (rUNet) for estimation of medical images. Our findings demonstrate that this approach is robust and versatile and can be applied to predicting a pending MRI examination of patients with Alzheimer's disease based on previous rounds of imaging, can perform medical image reconstruction (parametric mapping) in diffusion MRI, and can be applied to the estimation of one type of MRI examination from a collection of other types. Results demonstrate that the rUNet represents a single deep learning architecture capable of solving a variety of image estimation problems. Public domain code is provided.",Jueqi Wang|Derek Berger|David Mattie|Jacob Levman,Accept (Poster)
47,https://openreview.net/forum?id=70gFxx5ytwh,Double adversarial domain adaptation for whole-slide-imageclassification,"Image classification on whole-slide-image (WSI) is a challenging task. A previous work based on Fisher vector encoding provided a novel end-to-end pipeline with promising accuracy and computational efficiency.
However, this pipeline suffers from an accuracy drop when deployed to another dataset to perform the same task.
This poses a limitation on the practical use of the pipeline especially when the diagnoses of WSIs are hard to obtain.
This paper aims at providing a solution to mitigate the accuracy drop by using an unsupervised domain adaptation approach.
We propose to insert the domain classifiers into the pipeline in two stages to align the features during training. 
We evaluate accuracy by calculating the confusion matrices before and after the adaptation on two datasets. We demonstrate that placing domain classifiers in different stages will boost accuracy.
",Yuchen Yang|Amir Akbarnejad|Nilanjan Ray|Gilbert Bigras,Accept (Poster)
49,https://openreview.net/forum?id=pL_aFZKNO5N,Me-NDT: Neural-backed Decision Tree for Visual Explainability of Deep Medical Models,"Despite the progress of deep learning on medical imaging, there is still not a true understanding of what networks learn and of how decisions are reached. Here, we address this by proposing a Visualized Neural-backed Decision Tree for Medical image analysis, Me-NDT. It is a CNN with a tree-based structure template that allows for both classification and visualization of firing neurons, thus offering interpretability. We also introduce node and path losses that allow Me-NDT to consider the entire path instead of isolated nodes. Our experiments on brain CT and chest radiographs outperform all baselines. Overall, Me-NDT is a lighter, comprehensively explanatory model, of great value for clinical practice. ",Guanghui FU|Ruiqian Wang|Jianqiang Li|Maria Vakalopoulou|Vicky Kalogeiton,Accept (Poster)
