number,forum,title,abstract,authors,decision
50,https://openreview.net/forum?id=9o6zjvbo7b0,An artificial intelligence system for predicting the deterioration of COVID-19 patients in the emergency department,"During the COVID-19 pandemic, rapid and accurate triage of patients at the emergency department is critical to inform decision-making. We propose a data-driven approach for prediction of deterioration risk using a deep neural network that learns from chest X-ray images, and a gradient boosting model that learns from routine clinical variables. Our AI prognosis system, trained using data from 3,661 patients, achieves the AUC of 0.786 (95% CI: 0.742-0.827) when predicting deterioration within 96 hours. Our deep neural network indicates informative areas of chest X-ray images to assist clinicians in interpreting the predictions, and performs comparably to two experienced chest radiologists in a reader study. In summary, our findings demonstrate the potential of the proposed system for assisting front-line physicians in the triage of COVID-19 patients.",Farah Shamout|Yiqiu Shen|Nan Wu|Aakash Kaku|Jungkyu Park|Taro Makino|Stanisław Jastrzębski|Jan Witowski|Duo Wang|Ben Zhang|Siddhant Dogra|Meng Cao|Narges Razavian|David Kudlowitz|Lea Azour|William Moore|Yvonne Lui|Yindalon Aphinyanaphongs|Carlos Fernandez-Granda|Krzysztof J. Geras,Accept (Poster)
52,https://openreview.net/forum?id=ZVqjoKVbYMl,Multimodal Generative Learning on the MIMIC-CXR Database,"Machine Learning has become more and more popular in the medical domain over the past years. While supervised machine learning has already been applied successfully, the vast amount of unlabelled data offers new opportunities for un- and self-supervised learning methods. Especially with regard to the multimodal nature of most clinical data, the labelling of multiple data types becomes quickly infeasible in the medical domain. However, to the best of our knowledge, multimodal unsupervised methods have been tested extensively on toy-datasets only but have never been applied to real-world medical data, for direct applications such as disease classification and image generation. In this article, we demonstrate that self-supervised methods provide promising results on medical data while highlighting that the task is extremely challenging and that there is space for substantial improvements.",Hendrik J. Klug|Thomas M. Sutter|Julia E Vogt,Accept (Poster)
53,https://openreview.net/forum?id=rHAiz2pnxkB,$\mu$PEN: Multi-class PseudoEdgeNet for PD-L1 assessment,"In this paper, we take the recently presented PseudoEdgeNet model to the level of multi-class cell segmentation in histopathology images solely trained with point annotations. We tailor its loss function to the challenges of multi-class segmentation and equip it with an additional false positive loss term. We evaluate it on the assessment of tumor and immune cells in PD-L1 stained lung cancer histopathology images, and compare it with YOLOv5.",Jeroen Vermazeren|Leander van Eekelen|Luca Dulce Meesters|Monika Looijen-Salamon|Shoko Vos|Enrico Munari|Caner Mercan|Francesco Ciompi,Accept (Poster)
55,https://openreview.net/forum?id=HajxTQpPniD,Efficient biomedical image segmentation on Edge TPUs,"Biomedical semantic segmentation is typically performed on dedicated, costly hardware. In a recent study, we suggested an optimized, tiny-weight U-Net for an inexpensive hardware accelerator, the Google Edge TPU. Using an open biomedical dataset for high-speed laryngeal videoendoscopy, we exemplarily show that we can dramatically reduce the parameter space and computations while keeping a high segmentation quality. Using a custom upsampling routine, we fully deployed optimized architectures to the Edge TPU. Combining the optimized architecture and the Edge TPU, we gain a total speedup of >79$\times$ compared to our initial baseline while keeping a high accuracy. This combination allows to provide immediate results at the point of care, especially in constrained computational environments.",Andreas M Kist|Michael Döllinger,Accept (Poster)
59,https://openreview.net/forum?id=CSNQMsxteqm,Transformers for Ischemic Stroke Infarct Core Segmentation from Spatio-temporal CT Perfusion Scans,"The infarct core size is a crucial biomarker for treatment selection for ischemic stroke patients. For this purpose, we present a novel approach to perform infarct core segmentation using CT perfusion (CTP) source data, without ordinary deconvolution analysis. We propose the use of transformers to encode sequential CTP scans in spatial attention maps, which we subsequently use for infarct core segmentation. We report new top results on the ISLES 2018 challenge test data set for infarct core segmentation. This work presents a primary benchmark for infarct core segmentation from CTP source data using transformers.",Lucas de Vries|Bart Emmer|Charles Majoie|Henk Marquering|Efstratios Gavves,Accept (Poster)
62,https://openreview.net/forum?id=PLSdnHPx-W6,Deep ensemble model for segmenting microscopy images in the presence of limited labeled data,"Obtaining large amounts of high quality labeled microscopy data is expensive and time-consuming. To overcome this issue, we propose a deep ensemble model which aims to utilise limited labeled training data. We train multiple identical Convolutional Neural Network (CNN) segmentation models on training data that is partitioned into folds in two steps. First, the data is split based on sample diversity or expert knowledge reflecting the possible {\em modes} of the underlying data distribution. In the second step, these partitions are split into random folds like in a cross-validation setting. Segmentation models based on the U-net architecture are trained on each of these resulting folds yielding the candidate models for our deep ensemble model which are aggregated to obtain the final prediction. The proposed deep ensemble model is compared to relevant baselines, in their ability to segment interneurons in microscopic images of mice spinal cord, showing improved performance on an independent test set.",Jan Mikolaj Kaminski|Ilary Allodi|Roser Montañana-Rosell|Raghavendra Selvan|Ole Kiehn,Accept (Poster)
63,https://openreview.net/forum?id=ULm4D5bsiaE,TG-DGM: Clustering Brain Activity using a Temporal Graph Deep Generative Model,"Spatiotemporal graphs are a natural representation of dynamic brain activity derived from functional magnetic imaging (fMRI) data. Previous works, however, tend to ignore time dynamics of the brain and focus on static graphs. In this paper, we propose a temporal graph deep generative model (TG-DGM) which clusters brain regions into communities that evolve over time. In particular, subject embeddings capture inter-subject variability and its impact on communities using neural networks. We validate our model on the UK Biobank data. Results of up to 0.81 AUC ROC on the task of biological sex classification demonstrate that injecting time dynamics in our model outperforms a static baseline.",Simeon Emilov Spasov|Alexander Campbell|Giovana Dimitri|Alessandro Di Stefano|franco scarselli|Pietro Lio,Accept (Poster)
64,https://openreview.net/forum?id=7EZ4JOtlRl,Quality control of whole-slide images through multi-class semantic segmentation of artifacts,"Quality control is an integral part in the digitization process of whole-slide histopathology images due to artifacts that arise during various stages of slide preparation. Manual control and supervision of these gigapixel images are labor-intensive.  Therefore, we report the first multi-class deep learning model trained on whole-slide images covering multiple tissue and stain types for semantic segmentation of artifacts.  Our approach reaches a Dice score of 0.91, on average, across six artifact types, and outperforms the competition on external test set. Finally, we extend the artifact segmentation network to a multi-decision quality control system that can be deployed in routine clinical practice.",Gijs Smit|Francesco Ciompi|Maria Cigéhn|Anna Bodén|Jeroen van der Laak|Caner Mercan,Accept (Poster)
65,https://openreview.net/forum?id=0wblcjbC2sN,Interpretable Medical Image Classification with Self-Supervised Anatomical Embedding and Prior Knowledge,"In medical image analysis tasks, it is important to make machine learning models focus on correct anatomical locations, so as to improve interpretability and robustness of the model. We adopt a latest algorithm called self-supervised anatomical embedding (SAM) to locate point of interest (POI) on computed tomography (CT) scans. SAM can detect arbitrary POI with only one labeled sample needed. Then, we can extract targeted features from the POIs to train a simple prediction model guided by clinical prior knowledge. This approach mimics the practice of human radiologists, thus is interpretable, controllable, and robust. We illustrate our approach on the application of CT contrast phase classification and it outperforms an existing deep learning based method trained on the whole image.",Ke Yan|Youbao Tang|Adam P Harrison|Jinzheng Cai|Le Lu|Jingjing Lu,Accept (Poster)
67,https://openreview.net/forum?id=h7t0cFuX0m4,Recurrent Inference Machines as Inverse Problem Solvers for MR Relaxometry,"In this work, we propose the use of Recurrent Inference Machines (RIMs) to perform $T_1$ mapping. The RIM is a neural network framework that learns an iterative inference process using a model of the signal, similar to conventional statistical methods for quantitative MRI (QMRI), such as the Maximum Likelihood Estimator (MLE). Previously, RIMs were used to solve linear inverse reconstruction problems. Here, we show that they can also be used to optimize non-linear problems. The developed RIM framework is evaluated in terms of accuracy and precision and compared to an MLE method and an implementation of the ResNet. The results show that, compared to the other techniques in Monte Carlo experiments with simulated data, the RIM improves the precision of estimates without compromising in accuracy.",Emanoel Ribeiro Sabidussi|Stefan Klein|Matthan W. A. Caan|Shabab Bazrafkan|Arjan J. den Dekker|Jan Sijbers|Wiro Niessen|Dirk Poot,Accept (Poster)
68,https://openreview.net/forum?id=aGfL5C9wRx_,Test-Time Mixup Augmentation for Uncertainty Estimation in Skin Lesion Diagnosis,"Uncertainty is considered to be an important measure that provides valuable information on the learning behavior of deep neural networks. In this paper, we propose an uncertainty estimation method using test-time mixup augmentation (TTMA). The TTMA uncertainty is obtained by replacing affine augmentation with the mixup in the existing test-time augmentation (TTA) method. In addition to the data uncertainty, we propose TTMA-based class-specific uncertainty, which can provide information on between-class confusion. In experiments on the skin lesion diagnosis dataset, we confirmed that the proposed TTMA not only provides better epistemic uncertainty than TTA but also provides information on between-class confusion through class-specific uncertainty.",Hansang Lee|Haeil Lee|Helen Hong|Junmo Kim,Accept (Poster)
70,https://openreview.net/forum?id=CdQn5goh0E4,Comparison of CNN models on a multi-scanner database in colon cancer histology,"One of the most important challenges for computer-aided analysis in digital pathology is the development of robust deep neural networks, which can cope with variations in color and resolution of digitized whole-slide images (WSIs). It has been shown that color augmentation during training is a useful method to aid a model generalize better to heterogeneous data. In this work, we compare state of the art models EfficientNet, Xception, Inception, ResNet, DenseNet, MobileNet and QuickNet on a multi-scanner database comprising slides each digitized with six different scanners. All of the networks are trained with data of only one scanner applying a combination of color and blur augmentation techniques. All models show similar tendencies across the different scanner databases but differ in the overall classification accuracy. Differences in training and inference time, however, are more pronounced: on a mid-range GPU, the inference time of the fastest model (QuickNet) is 13 times faster than the slowest one (EfficientNet B4). There is also a trade-off between speed and accuracy, the slower networks are more stable across different scanners and show the overall best performance. A good compromise between quality and inference time is achieved by EfficientNet B0.",Petr Kuritcyn|Michaela Benz|Jakob Dexl|Volker Bruns|Arndt Hartmann|Carol Geppert,Accept (Poster)
73,https://openreview.net/forum?id=hPUnpHJHuy,Learning to Represent Whole Slide Images by Selecting Cell Graphs of Patches,"Advances in multiplex biomarker imaging systems have enabled the study of complex spatial biology within the tumor microenvironment. However, the high-resolution multiplexed images are often only available for a subset of regions of interest (RoIs), clinical data is not easily accessible and the datasets are generally too small to apply off-the-shelf deep learning methods commonly used in histopathology. In this paper, we focus on datasets with few images and without labels, and aim to learn representations for slides. We choose a task of patient identification that leads our new model to select RoIs with discriminative properties and infer patient-specific features that can be used later for any task via transfer learning. The experimental results on the synthetic data generated by taking the tumor microenvironment into account indicate that the proposed method is a promising step towards computer-aided analysis in unlabeled datasets of high-resolution images.",Yinan Zhang|Beril Besbinar|Pascal Frossard,Accept (Poster)
76,https://openreview.net/forum?id=tv_pkmFzdC,Robust medical image segmentation by adapting neural networks for each test image,"Performance of convolutional neural networks (CNNs) used for medical image analyses degrades markedly when training and test images differ in terms of their acquisition details, such as the scanner model or the protocol. We tackle this issue for the task of image segmentation by adapting a CNN ($C$) for each test image. Specifically, we design $C$ as a concatenation of a shallow normalization CNN ($N$), followed by a deep CNN ($S$) that segments the normalized image. At test time, we adapt $N$ for each test image, guided by an implicit prior on the predicted labels, which is modelled using an independently trained denoising autoencoder ($D$). The method is validated on multi-center MRI datasets of 3 anatomies. This article is a short version of the journal paper~\cite{karani2021test}.",Neerav Karani|Ertunc Erdil|Krishna Chaitanya|Ender Konukoglu,Accept (Poster)
80,https://openreview.net/forum?id=W9sz0zHk33h,Prediction of Ki67 scores from H&E stained breast cancer sections using convolutional neural networks,"Ki67 is an established marker of proliferation in breast cancer, but currently has limited clinical value due to limitations of the analytical validity of immunohistochemistry (IHC) -based Ki67 scoring. While the inter-assessor variability of scoring can be improved through image analysis software, Ki67 IHC also suffers from a lack of standardized staining protocols and is not part of routine pathology workflow in most countries. This could potentially be alleviated through directly predicting Ki67 scores from routine hematoxylin and eosin (H\&E) stained whole-slide-images (WSIs). We compared four different deep learning based approaches to  predict Ki67 scores from routine H\&E stained WSIs in a dataset that consists of matched H\&E and Ki67 WSIs from 126 breast cancer patients, resulting in a Spearman correlation between WSI cancer ROI averages of 0.546 for the best performing model in a 5-fold cross-validation (CV). These findings suggest that it is possible to predict the Ki67 score from H\&E stained WSIs, but validation in a larger cohort is required to meaningfully distinguish the performance of the methods that were investigated. ",Philippe Weitz|Balazs Acs|Johan Hartman|Mattias Rantalainen,Accept (Poster)
86,https://openreview.net/forum?id=XT40FwD5bV,Comparison of Representation Learning Techniques for Tracking in time resolved 3D Ultrasound,"3D ultrasound (3DUS) becomes more interesting for target tracking in radiation therapy due to its capability to provide volumetric images in real-time without using ionizing radiation. It is potentially usable for tracking without using fiducials. For this, a method for learning meaningful representations with which recognizing anatomical structures in different time frames is capable would be useful. In this study, 3DUS patches are reduced into a 128-dimensional representation space using conventional autoencoder, variational autoencoder and sliced-wasserstein autoencoder. In the representation space, the capability of separating different ultrasound patches as well as recognizing similar patches is investigated and compared based on a dataset of liver images. Two metrics to evaluate the tracking capability in the representation space are proposed. It is shown that ultrasound patches with different anatomical structures can be distinguished and sets of similar patches can be clustered in representation space. The results indicate that the investigated autoencoders have different levels of usability for target tracking in 3DUS.",Daniel Wulff|Jannis Hagenah|Floris Ernst,Accept (Poster)
89,https://openreview.net/forum?id=-KI5qmKvhKQ,Cine-MRI detection of abdominal adhesions with spatio-temporal deep learning,"Adhesions are an important cause of chronic pain following abdominal surgery. Recent developments in abdominal cine-MRI have enabled the non-invasive diagnosis of adhesions. Adhesions are identified on cine-MRI by the absence of sliding motion during movement. Diagnosis and mapping of adhesions  improves the management of patients with pain. Detection of abdominal adhesions on cine-MRI is challenging from both a radiological and deep learning perspective. We focus on classifying presence or absence of adhesions in sagittal abdominal cine-MRI series. We experimented with spatio-temporal deep learning architectures centered around a ConvGRU architecture. A hybrid architecture comprising a ResNet followed by a ConvGRU model allows to classify a whole time-series. Compared to a stand-alone ResNet with a two time-point (inspiration/expiration) input, we show an increase in classification performance (AUROC) from 0.74 to 0.83 ($p<0.05$). Our full temporal classification approach adds only a small amount (5%) of parameters to the entire architecture, which may be useful for other  medical imaging problems with a temporal dimension. ",Bram de Wilde|Richard P. G. ten Broek|Henkjan Huisman,Accept (Poster)
93,https://openreview.net/forum?id=wiKDehhdnz,Synthesis of Diabetic Retina Fundus Images Using Semantic Label Generation,"Automatic segmentation of retina lesions have been a long standing and challenging task for learning based models, mostly due to the lack of available and accurate lesion segmentation datasets. In this paper, we propose a two-step process for generating photo-realistic fundus images conditioned on synthetic ""ground truth"" semantic labels, and demonstrate its potential for further downstream tasks, such as, but not limited to; automated grading of diabetic retinopathy, dataset balancing, creating image examples for trainee ophthalmologists, etc.",Joon-Ho Son|Amir Alansary|Daniel Rueckert|Bernhard Kainz|Benjamin Hou,Accept (Poster)
94,https://openreview.net/forum?id=-j7vnPsPWys,Abnormality Detection in Histopathology via Density Estimation with Normalising Flows,Diagnosis of cancer often relies on the time-consuming examination of histopathology slides by expert pathologists. Automation via supervised deep learning methods require large amounts of pixel-wise annotated data that is costly to acquire. Unsupervised density estimation methods that rely only on the availability of healthy examples could cut down the cost of annotation. We propose to use residual flows as density estimator and compare different tests for out-of-distribution (OOD) detection. Our results suggest that unsupervised OOD detection is a viable approach for detecting suspicious regions in histopathology slides.,Nick Pawlowski|Ben Glocker,Accept (Poster)
96,https://openreview.net/forum?id=0bpkIn63sNG,Semi-Supervised Siamese Network for Identifying Bad Data in Medical Imaging Datasets,"Noisy data present in medical imaging datasets can often aid the development of robust models that are equipped to handle real-world data. However, if the bad data contains insufficient anatomical information, it can have a severe negative effect on the model's performance. We propose a novel methodology using a semi-supervised Siamese network to identify bad data. This method requires only a small pool of 'reference' medical images to be reviewed by a non-expert human to ensure the major anatomical structures are present in the Field of View. The model trains on this reference set and identifies bad data by using the Siamese network to compute the distance between the reference set and all other medical images in the dataset. This methodology achieves an Area Under the Curve (AUC) of 0.989 for identifying bad data. Code will be available at https://git.io/JYFuV.",Niamh Belton|Kathleen M Curran|Aonghus Lawlor,Accept (Poster)
98,https://openreview.net/forum?id=fanGydarIPF,3D Scout Scans Using Projection Domain Denoising,"Low dose 2D scouts, also known as topograms, are commonly used for CT scan planning. Although 3D CT volumes can provide more valuable information for the selection of the scan range and parameters, the very low X-ray dose used during scout scan acquisitions results in artefacts requiring effective denoising techniques to make them useful. This has proved challenging for traditional denoising algorithms. We propose a projection domain denoiser based on a convolutional neural network (CNN), which provides improved image quality even at ultra-low dose levels. We compare two CNNs operating on two data representations, a conventional line integral data and raw photon counts, which have different quantitative properties and dynamic ranges. The results show that the two denoising strategies give rise to different properties of reconstructed images and that both projection CNNs are effective for ultra-low dose CT denoising.",Mikhail Bortnikov|Frank Bergner|Alexey Chernyavskiy|Kevin M. Brown|Noel Black|Michael Grass,Accept (Poster)
99,https://openreview.net/forum?id=cA4VVWbNO-,Strength in Diversity: Understanding the impacts of diverse training sets in self-supervised pre-training for histology images,"Self-supervised learning (SSL) has demonstrated success in computer vision tasks for natural images, and recently histopathological images, where there is limited availability of annotations. Despite this, there has been limited research into how the diversity of source data used for SSL tasks impacts performance. The current study quantifies changes to downstream classification of metastatic tissue in lymph node sections of the PatchCamelyon dataset when datasets from different domains (natural images, textures, histology) are used for SSL pre-training. We show that for cases with limited training data, using diverse datasets from different domains for SSL pre-training can achieve comparable performance when compared with SSL pre-training on the target dataset.",Kristina Lynn Kupferschmidt|Eu Wern Teh|Graham W. Taylor,Accept (Poster)
101,https://openreview.net/forum?id=xqZTapYnEcG,Creating Anthropomorphic Phantoms via Unsupervised Convolutional Neural Networks,"Computerized phantoms play an important role in medical imaging research. They can serve as a gold standard for evaluating and optimizing medical imaging analysis, processing, and reconstruction methods. Existing computerized phantoms model anatomical variations through organ and phantom scaling, which does not fully capture the range of anatomical variations seen in humans. Here, we present a registration-based method for creating highly realistic and detailed anthropomorphic phantoms. The proposed registration method is built on the use of an unsupervised convolutional neural network (ConvNet) that warps the four-dimensional Xtended Cardiac-Torso (XCAT) phantom to a patient CT scan. The registration ConvNet iteratively optimizes an SSIM-based loss function for a given image pair without prior training. We experimentally show substantially improved image similarity of the generated phantom using the proposed method to a patient image.",Junyu Chen|Ye Li|Yong Du|Eric Frey,Accept (Poster)
106,https://openreview.net/forum?id=M1VznPOV5jV,Scopeformer: n-CNN-ViT hybrid model for Intracranial hemorrhage subtypes classification,"We propose a feature generator backbone composed of an ensemble of convolutional neural networks (CNNs) to improve the recently emerging Vision Transformer (ViT) models. We tackled the RSNA intracranial hemorrhage classification problem, i.e., identifying various hemorrhage  types  from  computed  tomography  (CT)  slices.   We  show  that  by gradually stacking  several  feature  maps  extracted  using  multiple  Xception  CNNs,  we  can develop a  feature-rich  input  for  the  ViT  model.   Our  approach  allowed  the  ViT  model  to  pay attention to relevant features at multiple levels.  Moreover, pretraining the ”n” CNNs using various paradigms leads to a diverse feature set and further improves the performance of the proposed n-CNN-ViT. We achieved a test accuracy of 98.04% with a weighted logarithmic loss value of 0.0708.  The proposed architecture is modular and scalable in both the number of CNNs used for feature extraction and the size of the ViT.",Yassine Barhoumi|Ghulam Rasool,Accept (Poster)
